{"schema":"mana.knowledge.documents/v1","index":{"freshness":"current","reason":"source-file-identities-match","revision":"sha256:1111111111111111111111111111111111111111111111111111111111111111"},"filters":{"scopes":["project"],"lifecycles":["active"]},"documents":[{"document_id":"doc_111111111111111111111111","source_reference":".mana/global/architecture.md","source_scope":"project","lifecycle_state":"active","title":"Payment Architecture","document_revision":"sha256:2222222222222222222222222222222222222222222222222222222222222222","byte_size":35}],"next_offset":null,"diagnostics":[]}
